code,description,description_es
0,"Agriculture, forestry and fishery products","Productos de la agricultura, la silvicultura y la pesca"
01,"Products of agriculture, horticulture and market gardening","Productos de la agricultura, la horticultura y la jardinería comercial"
011,"Cereals","Cereales"
012,"Vegetables","Hortalizas"
013,"Fruit and nuts","Frutas y frutos secos"
014,"Oilseeds and oleaginous fruits","Semillas y frutas oleaginosas"
015,"Edible roots and tubers with high starch or inulin content","Raíces y tubérculos comestibles con alto contenido en almidón o inulina"
016,"Stimulant, spice and aromatic crops","Cultivos estimulantes, de especias y aromáticos"
017,"Pulses (dried leguminous vegetables)","Legumbres (vegetales leguminosos secos)"
018,"Sugar crops","Cultivos de azúcar"
019,"Forage products, fibres, living plants, cut flowers and flower buds, unmanufactured tobacco, and natural rubber","Productos de forraje, fibras, plantas vivas, flores y capullos de flores, tabaco en rama, y caucho natural"
02,"Live animals and animal products (excluding meat)","Animales vivos y productos animales (excepto la carne)"
021,"Live animals","Animales vivos"
022,"Raw milk","Leche cruda"
023,"Eggs of hens or other birds in shell, fresh","Huevos de gallinas u otras aves, con cáscara, frescos"
024,"Reproductive materials of animals","Materiales de reproducción de los animales"
029,"Other animal products","Otros productos de animales"
03,"Forestry and logging products","Productos forestales y de la tala"
031,"Wood in the rough","Madera en bruto"
032,"Non-wood forest products","Productos forestales no madereros"
04,"Fish and other fishing products","Pescado y otros productos de la pesca"
041,"Fishes, live, fresh or chilled","Pescado, vivo, fresco o refrigerado"
042,"Crustaceans, not frozen; oysters; other molluscs and aquatic invertebrates, live, fresh or chilled","Crustáceos, sin congelar; ostras; otros moluscos e invertebrados acuáticos, vivos, frescos o refrigerados"
049,"Other aquatic plants and animals","Otras plantas y animales acuáticos"
1,"Ores and minerals; electricity, gas and water","Minerales; electricidad, gas y agua"
11,"Coal and lignite; peat","Carbón y lignito; turba"
110,"Coal and lignite; peat","Carbón y lignito; turba"
12,"Crude petroleum and natural gas","Petróleo crudo y gas natural"
120,"Crude petroleum and natural gas","Petróleo crudo y gas natural"
13,"Uranium and thorium ores and concentrates","Minerales y concentrados de uranio y torio"
130,"Uranium and thorium ores and concentrates","Minerales y concentrados de uranio y torio"
14,"Metal ores","Minerales metálicos"
141,"Iron ores and concentrates, other than roasted iron pyrites","Minerales y concentrados de hierro, excepto pirita de hierro tostadas"
142,"Non-ferrous metal ores and concentrates (other than uranium or thorium ores and concentrates)","Minerales concentrados de metales no ferrosos (excepto minerales y concentrados de uranio o torio)"
15,"Stone, sand and clay","Piedra, arena y arcilla"
151,"Monumental or building stone","Piedra de construcción o para tallado"
152,"Gypsum; anhydrite; limestone flux; limestone and other calcareous stone, of a kind used for the manufacture of lime or cement","Yeso; anhidrita; fundente calizo; piedra caliza y otras piedras calcáreas del tipo habitualmente utilizado para la fabricación de cal o cemento"
153,"Sands, pebbles, gravel, broken or crushed stone, natural bitumen and asphalt","Arenas, piedras, gravilla, piedras machacadas, bitumen natural y asfalto"
154,"Clays","Arcillas"
16,"Other minerals","Otros minerales"
161,"Chemical and fertilizer minerals","Minerales químicos y fertilizantes"
162,"Salt and pure sodium chloride; sea water","Sal y cloruro de sodio puro; agua de mar"
163,"Precious and semi-precious stones; pumice stone; emery; natural abrasives; other minerals","Piedras preciosas y semipreciosas; piedra pómez; esmeril; abrasivos naturales; otros minerales"
17,"Electricity, town gas, steam and hot water","Electricidad, gas de ciudad, vapor y agua caliente"
171,"Electrical energy","Energía eléctrica"
172,"Coal gas, water gas, producer gas and similar gases, other than petroleum gases and other gaseous hydrocarbons","Gas de coque, gas de agua, gas de generador y gases similares, excepto los gases de petróleo y de otros hidrocarburos gaseosos"
173,"Steam and hot water","Vapor y agua caliente"
174,"Ice and snow","Hielo y nieve"
18,"Natural water","Agua natural"
180,"Natural water","Agua natural"
2,"Food products, beverages and tobacco; textiles, apparel and leather products","Productos alimenticios, bebidas y tabaco; textiles, prendas de vestir y productos de cuero"
21,"Meat, fish, fruit, vegetables, oils and fats","Carne, pescado, frutas, vegetales, aceites y grasas"
211,"Meat and meat products","Carne y productos de carne"
212,"Prepared and preserved fish, crustaceans, molluscs and other aquatic invertebrates","Conservas y preparados de pescado, crustáceos, moluscos u otros invertebrados acuáticos"
213,"Prepared and preserved vegetables, pulses and potatoes","Vegetales, legumbres y papas preparadas y conservadas"
214,"Prepared and preserved fruit and nuts","Frutas y nueces preparadas y conservadas"
215,"Animal and vegetable oils and fats","Aceites y grasas animales y vegetales"
216,"Cotton linters","Borras de algodón (linters)"
217,"Oil-cake and other residues resulting from the extraction of vegetable fats or oils; flours and meals of oil seeds or oleaginous fruits, except those of mustard; vegetable waxes, except triglycerides; degras; residues resulting from the treatment of fatty substances or animal or vegetable waxes","Residuos de aceites de semillas y otros residuos que son resultados de la extracción de grasas o aceites vegetales; harinas y polvos de aceites de semillas o de frutas oleaginosas, excepto de la mostaza; ceras vegetales, excepto triglicéridos; degrás; residuos que son resultado del tratamiento de sustancias grasas o de ceras de animales o vegetales"
22,"Dairy products and egg products","Productos lácteos y productos de huevo"
221,"Processed liquid milk and cream","Leche liquida y crema procesada"
222,"Other dairy products","Otros productos lácteos"
223,"Eggs, in shell, preserved or cooked","Huevos, en cáscara, conservados o cocidos"
23,"Grain mill products, starches and starch products; other food products","Productos de molienda, productos con almidón o maicena; otros productos de alimenticios"
231,"Grain mill products","Productos de molienda"
232,"Starches and starch products; sugars and sugar syrups n.e.c.","Productos de almidones o maicena; azúcar y jarabes de azúcar, n.c.p."
233,"Preparations used in animal feeding","Preparaciones usadas en la alimentación animal"
234,"Bakery products","Productos de panadería"
235,"Sugar","Azúcar"
236,"Cocoa, chocolate and sugar confectionery","Cacao, chocolate y repostería de azúcar"
237,"Macaroni, noodles, couscous and similar farinaceous products","Macarrones, tallarines, cuscús y productos farináceos similares"
239,"Food products n.e.c.","Productos alimenticios n.c.p."
24,"Beverages","Bebidas"
241,"Ethyl alcohol; spirits, liqueurs and other spirituous beverages","Alcohol etílico, destilados, licores y otras bebidas destiladas"
242,"Wines","Vinos"
243,"Malt liquors and malt","Licores de malta y malta"
244,"Soft drinks; bottled mineral waters","Bebidas no alcohólicas, aguas minerales embotelladas"
25,"Tobacco products","Productos del tabaco"
250,"Tobacco products","Productos del tabaco"
26,"Yarn and thread; woven and tufted textile fabrics","Hilados e hilos; tejidos y telas afelpadas"
261,"Natural textile fibres prepared for spinning","Fibras textiles naturales preparadas para el hilado"
262,"Man-made textile staple fibres processed for spinning","Fibras artificiales o sintéticas, discontinuas procesadas para hilado"
263,"Textile yarn and thread of natural fibres","Hilados e hilos de fibras textiles naturales"
264,"Textile yarn and thread of man-made filaments or staple fibres","Hilados o hilos de filamentos artificiales o sintéticos discontinuas"
265,"Woven fabrics (except special fabrics) of natural fibres other than cotton","Tejidos (excepto telas especiales) de fibras naturales que no sea algodón"
266,"Woven fabrics (except special fabrics) of cotton","Tejidos (excepto telas especiales) de algodón"
267,"Woven fabrics (except special fabrics) of man-made filaments and staple fibres","Tejidos (excepto telas especiales) de filamentos artificiales o sintéticos y fibras discontinuas"
268,"Special fabrics","Tejidos especiales"
27,"Textile articles other than apparel","Artículos textiles que no sean prendas de vestir"
271,"Made-up textile articles","Artículos confeccionados con materias textiles"
272,"Carpets and other textile floor coverings","Alfombras y otros recubrimientos para pisos, de materias textiles"
273,"Twine, cordage, ropes and cables and articles thereof (including netting)","Lienza, cordeles, cuerdas y cables y artículos de los mismos (incluso redes)"
279,"Textiles n.e.c.","Textiles n.c.p."
28,"Knitted or crocheted fabrics; wearing apparel","Tejidos de punto o ganchillo; prendas de vestir"
281,"Knitted or crocheted fabrics","Tejidos de punto o ganchillo"
282,"Wearing apparel, except fur apparel","Prendas de vestir, excepto de peletería"
283,"Tanned or dressed furskins and artificial fur; articles thereof (except headgear)","Pieles, curtidas o adobadas, y pieles artificiales; artículos confeccionados con estas pieles (excepto artículos de tocado)"
29,"Leather and leather products; footwear","Cuero y productos de cuero; calzado"
291,"Tanned or dressed leather; composition leather","Cuero curtido o adobado; cuero artificial o regenerado"
292,"Luggage, handbags and the like; saddlery and harness; other articles of leather","Maletas, bolsos de mano y artículos similares; artículos de talabartería y guarnicionería; otros artículos de cuero"
293,"Footwear, with outer soles and uppers of rubber or plastics, or with uppers of leather or textile materials, other than sports footwear, footwear incorporating a protective metal toe- cap and miscellaneous special footwear","Calzado, con suela y parte superior de caucho o materias plásticas, o parte superior de cuero o materias textiles, que no sea calzado deportivo, calzado con puntera protectora de metal y calzado especial diverso"
294,"Sports footwear, except skating boots","Calzado para deportes, excepto botas para patinaje"
295,"Other footwear, except asbestos footwear, orthopaedic footwear and skating boots","Otros tipos de calzado, excepto calzado de asbesto, calzado ortopédico y botas para patinaje"
296,"Parts of footwear; removable insoles, heel cushions and similar articles; gaiters, leggings and similar articles, and parts thereof","Partes de calzado; plantillas removibles, taloneras y artículos similares; polainas y artículos similares y sus partes"
3,"Other transportable goods, except metal products, machinery and equipment","Otros bienes transportables, excepto productos metálicos, maquinaria y equipo"
31,"Products of wood, cork, straw and plaiting materials","Productos de materiales de madera, corcho, cestería y espartería"
311,"Wood, sawn or chipped lengthwise, sliced or peeled, of a thickness exceeding 6 mm; railway or tramway sleepers (cross-ties) of wood, not impregnated","Madera aserrada o cortada longitudinalmente, cortada en hojas o descortezada, con un espesor de más de 6 mm.; traviesas (durmientes) de madera para vías de ferrocarril o de tranvía sin impregnar"
312,"Wood continuously shaped along any of its edges or faces; wood wool; wood flour; wood in chips or particles","Madera perfilada longitudinalmente en cualquiera de sus bordes o caras; viruta de madera, aserrín, madera en astillas o partículas"
313,"Wood in the rough, including those treated with paint, stains, creosote or other preservatives; railway or tramway sleepers (cross-ties) of wood, impregnated","Madera en bruto, incluyendo las tratada con pintura, colorantes, creosota u otros preservativos; traviesas (durmientes) de madera para vías de ferrocarril o de tranvía, impregnadas"
314,"Boards and panels","Tableros y paneles"
315,"Veneer sheets; sheets for plywood; densified wood","Hojas de enchapado; hojas de contrachapado; madera compactada"
316,"Builders' joinery and carpentry of wood (including cellular wood panels, assembled parquet panels, shingles and shakes)","Obras y piezas de carpintería para edificios y construcción (incluso tableros de madera celular, tableros armados para pisos de parqué, tablillas y ripias)"
317,"Packing cases, boxes, crates, drums and similar packings, of wood; cable-drums of wood; pallets, box pallets and other load boards, of wood; casks, barrels, vats, tubs and other coopers' products and parts thereof, of wood (including staves)","Recipientes para embalaje, cajas, cajones, tambores y envases similares, de madera; tambores de madera para cables; pallets, pallets caja y otros dispositivos de carga, de madera; paneles, barriles, tinajas, tinas y demás productos de tonelería y sus partes (incluyendo duelas), de madera"
319,"Other products of wood; articles of cork, plaiting materials and straw","Otros productos de madera; artículos de corcho, materiales trenzables y paja"
32,"Pulp, paper and paper products; printed matter and related articles","Pulpa de papel, papel y productos de papel; impresos, y artículos similares"
321,"Pulp, paper and paperboard","Pulpa de papel, papel y cartón"
322,"Books, in print","Libros, impresos"
323,"Newspapers and periodicals, daily, in print","Periódicos y revistas, diarios, en forma impresa"
324,"Newspapers and periodicals, other than daily, in print","Periódicos y revistas, que no sean publicaciones diarias, en forma impresa"
325,"Printed maps; music, printed or in manuscript; postcards, greeting cards, pictures and plans","Mapas impresos; partituras impresas o manuscritas; tarjetas postales, tarjetas de felicitación, grabados y planos"
326,"Stamps, cheque forms, banknotes, stock certificates, brochures and leaflets, advertising material and other printed matter","Estampillas, talonarios de cheques, billetes de banco, certificados de acciones, folletos y panfletos, material de publicidad y otros impresos"
327,"Registers, account books, notebooks, letter pads, diaries and similar articles, blotting-pads, binders, file covers, forms and other articles of stationery, of paper or paperboard","Libros de registro, libros de contabilidad, cuadernillos de notas, bloques para cartas, agendas y artículos similares, secantes, encuadernadores, clasificadores para archivos, formularios y otros artículos de escritorio de papel o cartón"
328,"Composed type, prepared printing plates or cylinders, impressed lithographic stones or other impressed media for use in printing","Tipos de impresión, placas o cilindros de impresión preparados, piedras litográficas impresas u otros medios impresos para su uso en la impresión"
33,"Coke oven products; refined petroleum products; nuclear fuel","Productos de horno de coque; productos de petróleo refinado; combustibles nucleares"
331,"Coke and semi-coke of coal, of lignite or of peat; retort carbon","Coque y semicoque de hulla, de lignito o de turba; carbón de retorta"
332,"Tar distilled from coal, from lignite or from peat, and other mineral tars","Alquitrán destilado de hulla, lignito o turba y otros alquitranes minerales"
333,"Petroleum oils and oils obtained from bituminous materials, other than crude; preparations n.e.c. containing by weight 70% or more of these oils, such oils being the basic constituents of the preparations","Aceites de petróleo y aceites obtenidos de minerales bituminosos, que no sean aceites crudos; preparados n.c.p., que contengan por lo menos el 70% de su peso en aceites de esos tipos y cuyos componentes básicos sean esos aceites"
334,"Petroleum gases and other gaseous hydrocarbons, except natural gas","Gases de petróleo y otros hidrocarburos gaseosos, excepto gas natural"
335,"Petroleum jelly; paraffin wax, micro- crystalline petroleum wax, slack wax, ozokerite, lignite wax, peat wax, other mineral waxes, and similar products; petroleum coke, petroleum bitumen and other residues of petroleum oils or of oils obtained from bituminous materials","Vaselina; cera de parafina, cera de petróleo micro cristalina, cera cruda, ozoquerita, cera de lignito, cera de turba, otras ceras minerales, y productos similares; coque de petróleo, betún de petróleo y otros residuos de aceites de petróleo o de aceites obtenidos de minerales bituminosos"
336,"Radioactive elements and isotopes and compounds; alloys, dispersions, ceramic products and mixtures containing these elements, isotopes or compounds; radioactive residues","Elementos e isótopos radiactivos y sus compuestos; aleaciones, dispersiones, productos cerámicos y mezclas que contengan estos elementos, isótopos o compuestos; residuos radiactivos"
337,"Fuel elements (cartridges), for or of nuclear reactors","Elementos combustibles (cartuchos) para reactores nucleares o de reactores nucleares"
34,"Basic chemicals","Químicos básicos"
341,"Basic organic chemicals","Químicos orgánicos básicos"
342,"Basic inorganic chemicals n.e.c.","Químicos inorgánicos básicos n.c.p."
343,"Tanning or dyeing extracts; tannins and their derivatives; colouring matter n.e.c.","Extractos tintóreos o curtientes; taninos y sus derivados; materias colorantes n.c.p."
344,"Activated natural mineral products; animal black; tall oil; terpenic oils produced by the treatment of coniferous woods; crude dipentene; crude para-cymene; pine oil; rosin and resin acids, and derivatives thereof; rosin spirit and rosin oils; rum gums; wood tar; wood tar oils; wood creosote; wood naphtha; vegetable pitch; brewers' pitch","Productos minerales naturales activados; negro animal; aceite de resina; aceites terpénicos producidos por tratamiento de madera de coníferas; dipenteno crudo; paracimeno crudo; aceite de pino; colofonia y ácidos resínicos, y sus derivados; esencias de colofonia y aceites de colofonia, alquitrán de madera; aceites de alquitrán de madera, creosota de madera, nafta de madera, resina vegetal"
345,"Miscellaneous basic chemical products","Productos químicos básicos diversos"
346,"Fertilizers and pesticides","Fertilizantes y pesticidas"
347,"Plastics in primary forms","Plásticos en formas primarias"
348,"Synthetic rubber and factice derived from oils, and mixtures thereof with natural rubber and similar natural gums, in primary forms or in plates, sheets or strip","Caucho sintético y derivados artificial de aceites, y mezclas de estos con caucho natural y gomas naturales similares, en formas primarias o en planchas, hojas o tiras"
35,"Other chemical products; man-made fibres","Otros productos químicos; Fibras textiles artificiales o sintéticas"
351,"Paints and varnishes and related products; artists' colours; ink","Pinturas y barnices y productos relacionados; colores para la pintura artística; tinta"
352,"Pharmaceutical products","Productos farmacéuticos"
353,"Soap, cleaning preparations, perfumes and toilet preparations","Jabón, preparados para la limpieza, perfumes y preparados de tocador"
354,"Chemical products n.e.c.","Productos químicos n.c.p."
355,"Man-made fibres","Fibras textiles artificiales o sintéticas"
36,"Rubber and plastics products","Productos de caucho y plásticos"
361,"Rubber tyres and tubes","Neumáticos y cámaras de aire, de caucho"
362,"Other rubber products","Otros productos de caucho"
363,"Semi-manufactures of plastics","Semi elaboraciones de plástico"
364,"Packaging products of plastics","Producto de embalaje de plásticos"
369,"Other plastics products","Otros productos plásticos"
37,"Glass and glass products and other non-metallic products n.e.c.","Vidrios y productos de vidrio y otros productos no metálicos n.c.p."
371,"Glass and glass products","Vidrios y productos de vidrio"
372,"Non-structural ceramic ware","Artículos de cerámica no estructurales"
373,"Refractory products and structural non-refractory clay products","Productos refractarios y productos estructurales de arcilla no refractarios"
374,"Plaster, lime and cement","Yeso, cal y cemento"
375,"Articles of concrete, cement and plaster","Artículos de hormigón, cemento y yeso"
376,"Monumental or building stone and articles thereof","Piedra de construcción o de talla y artículos de los mismos"
379,"Other non-metallic mineral products n.e.c.","Otros productos minerales no metálicos n.c.p."
38,"Furniture; other transportable goods n.e.c.","Muebles; otros bienes transportables n.c.p."
381,"Furniture","Muebles"
382,"Jewellery and related articles","Joyas y artículos relacionados"
383,"Musical instruments","Instrumentos musicales"
384,"Sports goods","Artículos deportivos"
385,"Games and toys","Juegos y juguetes"
386,"Roundabouts, swings, shooting galleries and other fairground amusements","Carruseles, columpios, casetas de tiro al blanco y otras atracciones de feria"
387,"Prefabricated buildings","Edificios prefabricados"
389,"Other manufactured articles n.e.c.","Otros artículos manufacturados n.c.p."
39,"Wastes or scraps","Desperdicios o desechos"
391,"Wastes from food and tobacco industry","Desperdicios de la industria de la alimentación y el tabaco"
392,"Non-metal wastes or scraps","Desperdicios o desechos no metálicos"
393,"Metal wastes or scraps","Desperdicios o desechos metálicos"
399,"Other wastes and scraps","Otros desperdicios y desechos"
4,"Metal products, machinery and equipment","Productos metálicos, maquinaria y equipo"
41,"Basic metals","Metales comunes"
411,"Basic iron and steel","Productos comunes de hierro y acero"
412,"Products of iron or steel","Productos de hierro o acero"
413,"Basic precious metals and metals clad with precious metals","Metales preciosos comunes y metales revestidos con metales preciosos"
414,"Copper, nickel, aluminium, alumina, lead, zinc and tin, unwrought","Cobre, níquel, aluminio, alúmina, plomo, zinc y estaño, en bruto"
415,"Semi-finished products of copper, nickel, aluminium, lead, zinc and tin or their alloys","Productos semiacabados de cobre, níquel, aluminio, plomo, zinc y estaño o sus aleaciones"
416,"Other non-ferrous metals and articles thereof (including waste and scrap of some metals); cermets and articles thereof","Otros metales no ferrosos y sus manufacturas (incluso desperdicios y desechos de algunos metales); aleaciones metalocerámicas (cermet) y sus manufacturas"
42,"Fabricated metal products, except machinery and equipment","Productos metálicos elaborados, excepto maquinaria y equipo"
421,"Structural metal products and parts thereof","Productos metálicos estructurales y sus partes"
422,"Tanks, reservoirs and containers of iron, steel or aluminium","Depósitos, cisternas y recipientes de hierro, acero o aluminio"
423,"Steam generators, (except central heating boilers) and parts thereof","Calderas generadoras de vapor de agua (excepto calderas de agua caliente para calefacción central) y sus partes"
429,"Other fabricated metal products","Otros productos metálicos elaborados"
43,"General-purpose machinery","Maquinaria para usos generales"
431,"Engines and turbines and parts thereof","Motores y turbinas y sus partes"
432,"Pumps, compressors, hydraulic and pneumatic power engines, and valves, and parts thereof","Bombas, compresores, motores de fuerza hidráulica y motores de potencia neumática y válvulas y sus partes y piezas"
433,"Bearings, gears, gearing and driving elements, and parts thereof","Rodamientos, engranajes, trenes de engranajes y elementos de transmisión y sus partes y piezas"
434,"Ovens and furnace burners and parts thereof","Hornos y quemadores para alimentación de hogares y sus partes y piezas"
435,"Lifting and handling equipment and parts thereof","Equipo de elevación y manipulación y sus partes y piezas"
439,"Other general-purpose machinery and parts thereof","Otras máquinas para usos generales y sus partes y piezas"
44,"Special-purpose machinery","Maquinaria para usos especiales"
441,"Agricultural or forestry machinery and parts thereof","Maquinaria agrícola o forestal y sus partes y piezas"
442,"Machine-tools and parts and accessories thereof","Máquinas herramientas y sus partes, piezas y accesorios"
443,"Machinery for metallurgy and parts thereof","Maquinaria para la industria metalúrgica, y sus partes y piezas"
444,"Machinery for mining, quarrying and construction, and parts thereof","Maquinaria para la minería, la explotación de canteras y la construcción, y sus partes y piezas"
445,"Machinery for food, beverage and tobacco processing, and parts thereof","Maquinaria para la elaboración de alimentos, bebidas y tabaco, y sus partes y piezas"
446,"Machinery for textile, apparel and leather production, and parts thereof","Maquinaria para la fabricación de textiles, prendas de vestir y artículos de cuero, y sus partes y piezas"
447,"Weapons and ammunition and parts thereof","Armas y municiones, y sus partes y piezas"
448,"Domestic appliances and parts thereof","Aparatos de uso doméstico, y sus partes y piezas"
449,"Other special-purpose machinery and parts thereof","Otra maquinaria para usos especiales, y sus partes y piezas"
45,"Office, accounting and computing machinery","Maquinaria de oficina, contabilidad e informática"
451,"Office and accounting machinery, and parts and accessories thereof","Máquinas de oficina y de contabilidad, y sus partes, piezas y accesorios"
452,"Computing machinery and parts and accessories thereof","maquinaria de informática, y sus partes, piezas y accesorios"
46,"Electrical machinery and apparatus","Maquinaria y aparatos eléctricos"
461,"Electric motors, generators and transformers, and parts thereof","Motores, generadores y transformadores eléctricos, y sus partes y piezas"
